{
  "action": "replace",
  "change": {
    "after": "30-minute easy conversational run using the same session_id",
    "before": "50-minute controlled threshold session",
    "summary": "Replace today's hard quality anchor with an easy run and do not create a make-up workout"
  },
  "created_at": "2026-08-13T07:45:00+08:00",
  "event_id": "fixture-decision-2026-08-13-001",
  "evidence": [
    {
      "field": "planned_vs_actual",
      "observation": "Monday strength and Tuesday easy run matched the selected plan"
    },
    {
      "field": "sleep_trend",
      "observation": "Sleep is below the anonymous recent baseline across multiple observations"
    },
    {
      "field": "hrv_trend",
      "observation": "HRV is below the anonymous recent baseline across multiple observations"
    },
    {
      "field": "resting_hr_trend",
      "observation": "Resting heart rate is above the anonymous recent baseline"
    },
    {
      "field": "leg_fatigue",
      "observation": "Athlete-reported leg fatigue is elevated and every red flag is explicitly false"
    }
  ],
  "goal_effect": {
    "cycle": "The 28-day threshold objective remains unchanged and will be reassessed before the next anchor",
    "week": "One quality stimulus is not completed; weekly minutes and hard-session count decrease"
  },
  "inputs_used": [
    "planned_vs_actual",
    "sleep_trend",
    "hrv_trend",
    "resting_hr_trend",
    "athlete_reported_leg_fatigue"
  ],
  "mode": "revisit_today",
  "next_review_condition": "Revisit before the next planned anchor using updated actual training, recovery trends, and athlete-reported feel",
  "plan_id": "fixture-plan-001",
  "plan_version_after": 2,
  "plan_version_before": 1,
  "reason_codes": [
    "multi_signal_recovery_down",
    "quality_session_conflict"
  ],
  "schema_version": "1.0",
  "session_id": "run-quality-01",
  "unknowns": []
}
